Наименование товара,Ссылка на товар
Каша молочная Bebi Premium овсянка-персик 200г с 6месяцев,https://www.detmir.ru/product/index/id/4778134/
Пюре Ложка в ладошке яблочное 100г с 4месяцев,https://www.detmir.ru/product/index/id/3972725/
Пюре фруктовое Baby Go яблочное 100г с 4месяцев,https://www.detmir.ru/product/index/id/6456855/
Напиток сокосодержащий ФрутоНяня яблоко-банан-лимон-манго-маракуйя 130мл с 1года,https://www.detmir.ru/product/index/id/3707662/
Каша молочная Bebi Premium пшеничная печенье-груша 200г с 6месяцев,https://www.detmir.ru/product/index/id/4778137/
Каша молочная Hipp с пребиотиками злаки-чернослив 250г с 6месяцев,https://www.detmir.ru/product/index/id/764601/
Пюре Ложка в ладошке груша 100г с 4месяцев,https://www.detmir.ru/product/index/id/3972762/
Каша безмолочная Bebi Premium овсяная 200г с 5месяцев,https://www.detmir.ru/product/index/id/4778078/
Пюре Цыпленок с сердечками Егор Иваныч 12 шт по 80 г,https://www.detmir.ru/product/index/id/6153542/
Пюре Bebivita цыплёнок 100г с 6 месяцев,https://www.detmir.ru/product/index/id/6495774/
Пюре Рагу овощное с говядиной Habibi Халяль 6 шт по 100 г,https://www.detmir.ru/product/index/id/4238024/
Каша безмолочная Малютка рисовая 200г,https://www.detmir.ru/product/index/id/3094867/
Пюре Маленькое счастье Ягодный салатик для детей раннего возраст 90 г,https://www.detmir.ru/product/index/id/6186189/
Пюре фруктовое Baby Go яблоко-банан 100г с 6месяцев,https://www.detmir.ru/product/index/id/6456853/
Пюре для детского питания Черноголовка Бэйби Фруктовый салатик + мультизлак с 6 месяцев 12 шт по 85 г,https://www.detmir.ru/product/index/id/6416812/
Пюре Ложка в ладошке яблоко-банан 100г с 6месяцев,https://www.detmir.ru/product/index/id/3972768/
Сок Fleur Alpine апельсиновый прямого отжима 200г с 8 месяцев,https://www.detmir.ru/product/index/id/4672771/
Сокосодержащий напиток Сочная Долина Персик Яблоко 200 мл х 24 шт,https://www.detmir.ru/product/index/id/6356740/
Пюре Треска с овощами Егор Иваныч 12 шт по 100 г,https://www.detmir.ru/product/index/id/6153551/
Сок Сады Придонья яблоко-черная смородина 0.2л с 5месяцев,https://www.detmir.ru/product/index/id/577861/
Пюре Маленькое счастье фруктово-ягодный десерт со вкусом печенья 90г с 6 месяцев,https://www.detmir.ru/product/index/id/3972646/
Смесь Беллакт Комфорт Active 350г,https://www.detmir.ru/product/index/id/6167745/
Сок Ложка в ладошке яблоко-виноград 200мл с 6месяцев,https://www.detmir.ru/product/index/id/4107913/
Нектар Маленькое счастье Маша и Медведь яблоко-виноград 200мл с 8месяцев,https://www.detmir.ru/product/index/id/3972412/
Каша молочная Hipp с пребиотиками гречка 250г с 4месяцев,https://www.detmir.ru/product/index/id/602531/
Сок Сады Придонья яблоко-шиповник 0.2л с 6месяцев,https://www.detmir.ru/product/index/id/14051/
Пюре Ложка в ладошке персик 100г с 4месяцев,https://www.detmir.ru/product/index/id/3972761/
Пюре Hipp фруктовый десерт манго 100г с 6месяцев,https://www.detmir.ru/product/index/id/6404776/
Нектар ФрутоНяня из яблок бананов и манго для питания детей раннего возраста 0.2л,https://www.detmir.ru/product/index/id/6551549/
Сок Сады Придонья яблоко-груша 0.2л с 5месяцев,https://www.detmir.ru/product/index/id/3084722/
Соус Fleur Alpine 9овощей томатный 95г с 3лет,https://www.detmir.ru/product/index/id/4672774/
Каша молочная Bebi Premium фруктово-злаковое ассорти 200г с 6месяцев,https://www.detmir.ru/product/index/id/4778136/
Сокосодержащий напиток Сочная Долина Томатный 0.95 л х 6 шт,https://www.detmir.ru/product/index/id/6356044/
Пюре Цыпленок с сердечками Habibi Халяль 6 шт по 100 г,https://www.detmir.ru/product/index/id/4820491/
Пюре Сады Придонья яблоко-смородина 120г с 5месяцев,https://www.detmir.ru/product/index/id/2199011/
Пюре Кабачок Habibi Халяль 6 шт по 100 г,https://www.detmir.ru/product/index/id/4238043/
Смесь молочная Goattiny детская на козьем молоке 3,https://www.detmir.ru/product/index/id/4037994/
Пюре Маленькое счастье брокколи 80г с 4месяцев,https://www.detmir.ru/product/index/id/3991590/
Пюре Треска с овощами Habibi Халяль 12 шт по 100 г,https://www.detmir.ru/product/index/id/6153547/
Сок Сады Придонья яблоко-персик с мякотью 0.2л с 6месяцев,https://www.detmir.ru/product/index/id/14031/
Нектар Малышарики мультифрукт 200мл с 8месяцев Малышарики,https://www.detmir.ru/product/index/id/4843876/
Каша безмолочная Heinz Я большой гречневая 200г с 12месяцев,https://www.detmir.ru/product/index/id/4894853/
Нектар Маленькое счастье Маша и Медведь мультифрукт 200мл с 8месяцев,https://www.detmir.ru/product/index/id/3972410/
Пюре Индейка Егор Иваныч 12 шт по 80 г,https://www.detmir.ru/product/index/id/6153546/
Пюре Маленькое счастье кабачок 80г с 4месяцев,https://www.detmir.ru/product/index/id/3991591/
Пюре Ложка в ладошке кабачок 100г с 4месяцев,https://www.detmir.ru/product/index/id/3991625/
Каша безмолочная Малютка овсяная 200г,https://www.detmir.ru/product/index/id/3094868/
Печенье детское Сладкая сказка Crunch Time Pusheen 20г х 12 штук,https://www.detmir.ru/product/index/id/6422530/
Пюре Ложка в ладошке кабачок-морковь-картошка 100г с 5месяцев,https://www.detmir.ru/product/index/id/4076420/
Пюре Hipp органик спагетти помидор-моцарелла 220г с 8 месяцев,https://www.detmir.ru/product/index/id/4792452/
Пюре Говядина с сердцем Habibi Халяль 6 шт по 100 г,https://www.detmir.ru/product/index/id/4514966/
Кисель ФрутоНяня вишня 130г с 12месяцев,https://www.detmir.ru/product/index/id/6207674/
Каша молочная Bebi Premium пшеничная яблоко-банан 200г с 6месяцев,https://www.detmir.ru/product/index/id/4778135/
Вода Черноголовка детская негазированная 0.33л с 0месяцев в ассортименте,https://www.detmir.ru/product/index/id/3414695/
Сок Сады Придонья яблоко-банан 0.125л с 6месяцев,https://www.detmir.ru/product/index/id/3294507/
Смесь сухая молочная Беллакт с бифидобактериями «Bellakt Immuno Аctive 2» от 6 мес до 1 года 400 г,https://www.detmir.ru/product/index/id/4597303/
Каша молочная Bebi Premium гречневая яблоко-абрикос 200г с 5месяцев,https://www.detmir.ru/product/index/id/4778131/
Пюре Bebivita яблоко 100г с 4 месяцев,https://www.detmir.ru/product/index/id/453771/
Нектар Фиксики мультифруктовый 200мл с 8месяцев,https://www.detmir.ru/product/index/id/3972191/
Пюре Bebivita индейка 100г с 6 месяцев,https://www.detmir.ru/product/index/id/453691/
Пюре Говядина с сердцем Habibi Халяль 12 шт по 100 г,https://www.detmir.ru/product/index/id/6153555/
Каша молочная Bebi Premium овсяная 200г с 5месяцев,https://www.detmir.ru/product/index/id/4778133/
Фрикадельки Bebivita из мяса цыплят 100г с 8 месяцев,https://www.detmir.ru/product/index/id/6495775/
Каша безмолочная Heinz Я большой овсяная 200г с 12месяцев,https://www.detmir.ru/product/index/id/4894854/
Каша молочная Bebi Premium гречневая 200г с 4месяцев,https://www.detmir.ru/product/index/id/4778130/
Каша Винни молочная кукурузная с пребиотиком 200г с 5месяцев,https://www.detmir.ru/product/index/id/2324201/
Каша Винни молочная пшеничная-тыква с пребиотиком 200г с 5месяцев,https://www.detmir.ru/product/index/id/2992101/
Каша молочная Nutrilak Premium Procereals гречневая чернослив 200г с 4месяцев,https://www.detmir.ru/product/index/id/3278858/
Смесь молочная Goattiny детская на козьем молоке 2,https://www.detmir.ru/product/index/id/4037993/
Кисель Когда я вырасту вишневый 85г с 12месяцев,https://www.detmir.ru/product/index/id/6482326/
Мюсли Bionova Crunchy ореховые 400г,https://www.detmir.ru/product/index/id/3422206/
Смесь Беллакт Гипоаллергенный Active 2 300г,https://www.detmir.ru/product/index/id/6167747/
Пюре Ложка в ладошке яблоко 130г с 4месяцев,https://www.detmir.ru/product/index/id/5084259/
Пюре для детского питания Черноголовка Бэйби Ягодный салатик + мультизлак с 6 месяцев 12 шт по 85 г,https://www.detmir.ru/product/index/id/6416801/
Пюре для детского питания Черноголовка Бэйби яблочное с 4 месяцев 12 шт по 85 г,https://www.detmir.ru/product/index/id/6416809/
Чай детский гранулированный Белый мишка Ягодный Шиповник + Малина 250 г.,https://www.detmir.ru/product/index/id/6373362/
Фрикадельки Bebivita из мяса индейки 100г с 8 месяцев,https://www.detmir.ru/product/index/id/6495776/
Каша Винни молочная гречневая с пребиотиком 200г с 4месяцев,https://www.detmir.ru/product/index/id/2324161/
Нектар Ложка в ладошке Три Кота яблочно-вишнёвый 200мл с 5месяцев в ассортименте,https://www.detmir.ru/product/index/id/3869181/
Пюре Цыпленок Егор Иваныч 6 шт по 80 г,https://www.detmir.ru/product/index/id/4234124/
Пюре Маленькое счастье яблоко-малина-клубника 90г с 8месяцев,https://www.detmir.ru/product/index/id/3972520/
Смесь сухая молочная Беллакт «Иммунис 1+» с бифидобактериями от 0 мес. 400 г,https://www.detmir.ru/product/index/id/4625479/
Кисель Леовит LeoKids успокаивающий 12г*5пакетов,https://www.detmir.ru/product/index/id/4710244/
Пюре Брокколи Habibi Халяль 6 шт по 100 г,https://www.detmir.ru/product/index/id/4238020/
Пюре Bebivita груша 100г с 4 месяцев,https://www.detmir.ru/product/index/id/453681/
Сок Агуша яблоко-банан-клубника-арония-киви 200мл с 8месяцев,https://www.detmir.ru/product/index/id/4654083/
Печенье с шоколадом Take a Bitey Банан 125г,https://www.detmir.ru/product/index/id/6475201/
Печенье с шоколадом Take a Bitey Шоколад 125г,https://www.detmir.ru/product/index/id/6475202/
Вода Черноголовка детская негазированная 1.5л с 0месяцев в ассортименте,https://www.detmir.ru/product/index/id/3414696/
Пюре Ложка в ладошке из банана груш и яблок 100г с 6месяцев,https://www.detmir.ru/product/index/id/3972727/
Пюре Кускус-цыпленок-овощи Habibi Халяль 6 шт по 100 г,https://www.detmir.ru/product/index/id/4229537/
Пюре Агуша кролик 80 г с 6 месяцев,https://www.detmir.ru/product/index/id/453371/
Пюре Цветная капуста Habibi Халяль 6 шт по 100 г,https://www.detmir.ru/product/index/id/4238044/
Пюре Bebivita яблоко с грушей 100г с 5 месяцев,https://www.detmir.ru/product/index/id/453761/
Каша Винни молочная овсяная с яблоком и черносливом 200г с 5месяцев,https://www.detmir.ru/product/index/id/2992121/
Пюре Треска с овощами Habibi Халяль 6 шт по 100 г,https://www.detmir.ru/product/index/id/4238040/
Сок Ложка в ладошке Три Кота яблочный 200мл с 4месяцев в ассортименте,https://www.detmir.ru/product/index/id/3869166/
Питание Нутриция NutriniDrink с пищевыми волокнами для детей с 12 месяцев при повышенных потребностях в белке и энергии 200 мл,https://www.detmir.ru/product/index/id/6508713/
Пюре Говядина с сердцем Егор Иваныч 6 шт по 80 г,https://www.detmir.ru/product/index/id/4234110/
Сок Ложка в ладошке яблочно-черничный восстановленный с 5месяцев,https://www.detmir.ru/product/index/id/3972680/
Кисель Леовит LeoKids общеукрепляющий 12г*5пакетов,https://www.detmir.ru/product/index/id/4710241/
Каша сухая на козьем молоке Беллакт пшеничная с грушей и бананом 200 г х 2 шт,https://www.detmir.ru/product/index/id/4816346/
Пюре Овощной салатик Habibi Халяль 6 шт по 100 г,https://www.detmir.ru/product/index/id/4238022/
Печенье с шоколадом Take a Bitey Лесные ягоды 125г,https://www.detmir.ru/product/index/id/6475200/
Каша безмолочная манная Здоровые детки гречневая без глютена с 6 месяцев,https://www.detmir.ru/product/index/id/5061056/
Сок Ложка в ладошке мультифрукт 200мл с 8месяцев,https://www.detmir.ru/product/index/id/4107912/
Нектар Малышам яблоко-груша 0.125л с 5месяцев,https://www.detmir.ru/product/index/id/1205641/
Сок Ложка в ладошке яблочно-персиковый с мякотью восстановленный с 6месяцев,https://www.detmir.ru/product/index/id/3972679/
Пюре Сады Придонья яблоко-персик 120г с 5месяцев,https://www.detmir.ru/product/index/id/1984731/
Пюре Индейка с печенью Егор Иваныч 12 шт по 80 г,https://www.detmir.ru/product/index/id/6153550/
Каша Винни молочная 3 злака с манго и бананом 200 г с 6месяцев,https://www.detmir.ru/product/index/id/2324211/
Напиток сухой молочный Беллакт с бифидобактериями «Bellakt Immuno Active 3» от 1 года 400 г,https://www.detmir.ru/product/index/id/4597302/
Напиток ФрутоНяня яблоко-черноплодная рябина-апельсин-вишня-лимон-мята 130мл с 1года,https://www.detmir.ru/product/index/id/3989006/
Каша Винни молочная рисовая с пребиотиком 200 г с 4месяцев,https://www.detmir.ru/product/index/id/2324181/
Нектар Маленькое счастье Маша и Медведь яблоко-банан 200мл с 8месяцев,https://www.detmir.ru/product/index/id/3972411/
Нектар Ложка в ладошке Три Кота яблочно-персиковый с мякотью 200мл с 5месяцев в ассортименте,https://www.detmir.ru/product/index/id/3869184/
Пюре Ложка в ладошке морковь 100г с 4месяцев,https://www.detmir.ru/product/index/id/3991626/
Нектар Фиксики яблоко-виноград 200мл с 6месяцев,https://www.detmir.ru/product/index/id/3972698/
Каша безмолочная манная Здоровые детки ячменная с 12 месяцев,https://www.detmir.ru/product/index/id/5061059/
Пюре Треска с овощами Егор Иваныч 6 шт по 100 г,https://www.detmir.ru/product/index/id/4234122/
Каша молочная сухая Беллакт кукурузно-овсяная с грушей с пребиотиком 250г х 2шт,https://www.detmir.ru/product/index/id/5145397/
Пюре Сады Придонья морковь 125г с 5месяцев,https://www.detmir.ru/product/index/id/3294541/
Пюре Говядина с печенью Егор Иваныч 6 шт по 80 г,https://www.detmir.ru/product/index/id/4234109/
Пюре Говядина Егор Иваныч 12 шт по 80 г,https://www.detmir.ru/product/index/id/6153513/
Сок Ложка в ладошке яблочный 200мл с 4месяцев,https://www.detmir.ru/product/index/id/4107910/
Каша безмолочная манная Здоровые детки рисовая без глютена с 6 месяцев,https://www.detmir.ru/product/index/id/5061052/
Макароны детские Pasta la Bella Baby вермишелька 2 упаковки,https://www.detmir.ru/product/index/id/4731492/
Пюре Кабачок Егор Иваныч 6 шт по 80 г,https://www.detmir.ru/product/index/id/4234115/
Кисель Леовит LeoKids желудочный 12г*5пакетов,https://www.detmir.ru/product/index/id/4710240/
Каша безмолочная манная Здоровые детки из пшеницы с 12 месяцев,https://www.detmir.ru/product/index/id/5061054/
Каша безмолочная манная Здоровые детки кукурузная без глютена с 6 месяцев,https://www.detmir.ru/product/index/id/5061053/
Смесь Беллакт Сухая молочная Пре 400г,https://www.detmir.ru/product/index/id/6167743/
Пюре Ложка в ладошке капуста брокколи 100г с 4месяцев,https://www.detmir.ru/product/index/id/3991629/
Пюре Яблоко-банан-творог Habibi Халяль 6 шт по 100 г,https://www.detmir.ru/product/index/id/4820492/
Пюре Сады Придонья яблоко-вишня 120г,https://www.detmir.ru/product/index/id/1984761/
Нектар Фиксики яблоко-груша 200мл с 4месяцев,https://www.detmir.ru/product/index/id/6207798/
Каша безмолочная манная Здоровые детки из полбы с 12 месяцев,https://www.detmir.ru/product/index/id/5061055/
Пюре Бибиколь фруктово-молочное для питания детей с 6 месяцев 80г,https://www.detmir.ru/product/index/id/6535127/
Сок Ложка в ладошке яблоко-банан с мяк 200мл с 6месяцев,https://www.detmir.ru/product/index/id/3972758/
Соус Fleur Alpine Детское лечо томатный с овощами 95г с 3лет,https://www.detmir.ru/product/index/id/4672773/
Печенье Choco-Boy Safari с глазурью кокос 39г,https://www.detmir.ru/product/index/id/6002518/
Пюре Яблоко и груша Habibi Халяль 6 шт по 100 г,https://www.detmir.ru/product/index/id/4238037/
Каша Винни молочная 5 злаков с пребиотиком 200г с 6месяцев,https://www.detmir.ru/product/index/id/2324151/
Смесь сухая молочная Беллакт Immuno Activе 1 с бифидобактериями от 0 до 6 мес. 400 г,https://www.detmir.ru/product/index/id/4597301/
Пюре Яблоко -банан-творог Егор Иваныч 6 шт по 100 г,https://www.detmir.ru/product/index/id/4234133/
Пюре Брокколи Егор Иваныч 6 шт по 80 г,https://www.detmir.ru/product/index/id/4234107/
Пюре Маленькое счастье яблоко-черника 80г с 5месяцев,https://www.detmir.ru/product/index/id/4956145/
"Сок ФрутоНяня из яблок и шиповника 0,5 л от 3 лет",https://www.detmir.ru/product/index/id/2458941/
Каша молочная Беллакт рисовая быстрорастворимая 200г х 3 шт,https://www.detmir.ru/product/index/id/4535263/
Каша молочная Беллакт гречневая с пребиотиком 3 шт,https://www.detmir.ru/product/index/id/5149944/
Каша Винни молочная 3 злака с фруктами 200г с 6месяцев,https://www.detmir.ru/product/index/id/2324221/
Каша молочная Винни 4 злака с кусочками клубники и с яблоком 200г,https://www.detmir.ru/product/index/id/6462533/
Каша Винни молочная рисово-кукурузная с бананом 200г с 6месяцев,https://www.detmir.ru/product/index/id/2324191/
Вода Черноголовка Бэйби детская негазированная 5л с 0месяцев,https://www.detmir.ru/product/index/id/3819258/
Пюре овощное Беллакт из цветной капусты 100г х 6 шт.,https://www.detmir.ru/product/index/id/6003709/
Каша Винни молочная 5 злаков яблоко-малина 200г 6месяцев,https://www.detmir.ru/product/index/id/2992111/
Пюре Овощной салатик Егор Иваныч 6 шт по 80 г,https://www.detmir.ru/product/index/id/4234118/
Пюре Индейка с печенью Егор Иваныч 6 шт по 80 г,https://www.detmir.ru/product/index/id/4234113/
Каша безмолочная манная Здоровые детки овсяная без глютен с 6 месяцев,https://www.detmir.ru/product/index/id/5061060/
Пюре Говядина с печенью Егор Иваныч 12 шт по 80 г,https://www.detmir.ru/product/index/id/6153552/
Закваска бактериальная Иван-поле йогурта по-гречески 10 порций по 2 г,https://www.detmir.ru/product/index/id/6422876/
Пюре Персик без сахара Habibi Халяль 6 шт по 100 г,https://www.detmir.ru/product/index/id/4820493/
Смесь сухая молочная Mamelle Pro Bio 1 адаптированная от 0 400г,https://www.detmir.ru/product/index/id/6474682/
Пюре Bebivita Картофель с овощами и индейкой 190г с 9 месяцев,https://www.detmir.ru/product/index/id/6495777/
Каша безмолочная Bebi Premium кукурузная пребиотики 200г с 5 месяцев,https://www.detmir.ru/product/index/id/4778077/
Сухой завтрак Здоровей шарики рисово-кукурузные без сахара 30 грамм,https://www.detmir.ru/product/index/id/6068951/
Каша молочная Винни 3 злака с овсяными хлопьями и кусочками банана 200г,https://www.detmir.ru/product/index/id/6462710/
Суп овощной Bebivita с индейкой 190г с 8 месяцев,https://www.detmir.ru/product/index/id/6495780/
Печенье КУКИ кокосовое без глютена 210 г,https://www.detmir.ru/product/index/id/4913656/
Печенье Choco-Boy чёрная смородина 45г,https://www.detmir.ru/product/index/id/6002516/
Закваска бактериальная Иван-поле для ряженки 10 порций по 2 г,https://www.detmir.ru/product/index/id/6422880/
Печенье Choco-Boy с глазурью клубника-йогурт 39г,https://www.detmir.ru/product/index/id/6004043/
Смесь сухая молочная Беллакт «Иммунис 1+» с бифидобактериями 400г х 2 шт,https://www.detmir.ru/product/index/id/4535276/
Сухой завтрак Здоровей шарики рисовые без сахара 30 грамм,https://www.detmir.ru/product/index/id/6068950/
Сухой завтрак Сладкая сказка с шоколадными шариками CRUNCH TIME ТРИ КОТА 170 г,https://www.detmir.ru/product/index/id/5086445/
Каша Винни безмолочная гречка 200г с 4месяцев,https://www.detmir.ru/product/index/id/2324141/
