Наименование товара,Ссылка на товар
Смесь NAN Тройной комфорт сухая молочная 800г с 0месяцев,https://www.detmir.ru/product/index/id/3094191/
Смесь сухая Nutrilon Пепти Аллергия 800г с 0 месяцев,https://www.detmir.ru/product/index/id/3101507/
Смесь молочная Nestogen 2 1050г с 6месяцев,https://www.detmir.ru/product/index/id/3163069/
Смесь сухая Nutrilon Пепти Гастро 800г с 0месяцев,https://www.detmir.ru/product/index/id/3419877/
Смесь молочная Nestogen 1 1050г с 0месяцев,https://www.detmir.ru/product/index/id/3163068/
Смесь NAN 2 Optipro 1050г с 6месяцев,https://www.detmir.ru/product/index/id/4682448/
Смесь молочная Kabrita 2 Gold 800г с 6месяцев,https://www.detmir.ru/product/index/id/3194078/
Молочко детское Nutrilon Premium 3 1200г с 12месяцев,https://www.detmir.ru/product/index/id/3168638/
Смесь молочная Nutrilon Премиум 1 1200г с 0месяцев,https://www.detmir.ru/product/index/id/3168636/
Смесь молочная Nutrilon Премиум 2 1200г с 6месяцев,https://www.detmir.ru/product/index/id/3168637/
Смесь NAN 1 800г с 0месяцев,https://www.detmir.ru/product/index/id/12361/
Молочко Nestogen 4 900г с 18месяцев,https://www.detmir.ru/product/index/id/3903750/
Смесь молочная Nutrilon Комфорт 1 900г с 0 месяцев,https://www.detmir.ru/product/index/id/139952/
Смесь NAN 2 800г с 6 месяцев,https://www.detmir.ru/product/index/id/12391/
Молочко Nestogen 3 900г с 12месяцев,https://www.detmir.ru/product/index/id/3903749/
Смесь NAN 1 Optipro 1050г с 0месяцев,https://www.detmir.ru/product/index/id/3513046/
Смесь NAN безлактозная 400г с 0 до 6мес,https://www.detmir.ru/product/index/id/12431/
Смесь NAN 2 гипоаллергенная 800г с 6месяцев,https://www.detmir.ru/product/index/id/3249560/
Смесь молочная Nutrilon Комфорт 2 800г с 6 месяцев,https://www.detmir.ru/product/index/id/3101510/
Смесь Мамако 1 Premium на козьем молоке 800г с 0месяцев,https://www.detmir.ru/product/index/id/4226428/
Молочко NAN 3 Optipro 1050г с 12месяцев,https://www.detmir.ru/product/index/id/4055842/
Смесь молочная Nutrilak Premium 2 1050г с 6месяцев,https://www.detmir.ru/product/index/id/3946612/
Смесь молочная Nutrilak Premium 1 1050г с 0месяцев,https://www.detmir.ru/product/index/id/3946611/
Молочко детское Nutrilon Premium 4 1200г с 18месяцев,https://www.detmir.ru/product/index/id/3168639/
Смесь Мамако 2 Premium на козьем молоке 800г с 6месяцев,https://www.detmir.ru/product/index/id/4226426/
Смесь Similac Голд 1 800г с 0месяцев,https://www.detmir.ru/product/index/id/3117636/
Смесь молочная Kabrita 1 Gold 800г c 0месяцев,https://www.detmir.ru/product/index/id/3194076/
Молочная смесь Бибиколь Классика на основе козьего молока 800 г с 0-12 мес,https://www.detmir.ru/product/index/id/2622381/
Cмесь NAN на козьем молоке 400г с 0месяцев,https://www.detmir.ru/product/index/id/3989004/
Смесь молочная Hipp 1 Combiotic Expert 900г с 0месяцев,https://www.detmir.ru/product/index/id/3538053/
Молочко NAN 3 800 г с 12 месяцев,https://www.detmir.ru/product/index/id/141322/
Молочко NAN 4 Optipro 1050г с 18месяцев,https://www.detmir.ru/product/index/id/4055843/
Смесь NAN 1 гипоаллергенная 800г с 0месяцев,https://www.detmir.ru/product/index/id/3249559/
Смесь молочная Nutrilak Premium 3 900г с 12месяцев,https://www.detmir.ru/product/index/id/4913700/
Смесь Similac Голд 2 800г с 6месяцев,https://www.detmir.ru/product/index/id/3117644/
Смесь молочная Бибиколь Нэнни 1 на основе козьего молока 800г с 0-6месяцев,https://www.detmir.ru/product/index/id/6480643/
Смесь NAN 1 гипоаллергенная 800г с 0месяцев,https://www.detmir.ru/product/index/id/3249559/
Смесь молочная Nutrilak Premium 3 900г с 12месяцев,https://www.detmir.ru/product/index/id/4913700/
Смесь Similac Голд 2 800г с 6месяцев,https://www.detmir.ru/product/index/id/3117644/
Смесь молочная Бибиколь Нэнни 1 на основе козьего молока 800г с 0-6месяцев,https://www.detmir.ru/product/index/id/6480643/
Смесь Nestle Alfare Allergy HMO 400г с 0месяцев,https://www.detmir.ru/product/index/id/4795467/
Молочная смесь Бибиколь Классика на основе козьего молока 400 г с 0-12 мес,https://www.detmir.ru/product/index/id/134612/
Молочко NAN 4 800г с 18месяцев,https://www.detmir.ru/product/index/id/501241/
Смесь NAN Антиаллергия 400г с 0месяцев,https://www.detmir.ru/product/index/id/3627102/
Смесь молочная Nutrilon 2 ГА 800г с 6месяцев,https://www.detmir.ru/product/index/id/6115331/
Cмесь Nestle Alfare Gastro 400г c 0месяцев,https://www.detmir.ru/product/index/id/4966142/
Смесь Nutricia Neocate LCP для детей с пищевой аллергией 400г c 0месяцев,https://www.detmir.ru/product/index/id/3127860/
Молочный напиток Бибиколь 3 на основе козьего молока 800 г с 12 мес,https://www.detmir.ru/product/index/id/2622371/
Смесь сухая Nutrilon безлактозная 400г с 0 месяцев,https://www.detmir.ru/product/index/id/139432/
Смесь NAN Supreme 800г с 0месяцев,https://www.detmir.ru/product/index/id/3162659/
Смесь молочная Nutrilon Profutura DuoBiotik 1 сухая 800г с 0месяцев,https://www.detmir.ru/product/index/id/6074668/
Смесь молочная Nutrilon Profutura DuoBiotik 2 сухая 800г с 6месяцев,https://www.detmir.ru/product/index/id/6074669/
Смесь сухая NAN Supreme молочная 0-12 мес 800 г,https://www.detmir.ru/product/index/id/6548786/
Смесь Nutrilak Premium Proallergy Amino 400г с 0месяцев,https://www.detmir.ru/product/index/id/4047282/
Смесь молочная Малютка Комфорт PRO 600г с 0 месяцев,https://www.detmir.ru/product/index/id/3864000/
Смесь молочная Kabrita 3 Gold 800г с 12месяцев,https://www.detmir.ru/product/index/id/3194079/
Cмесь сухая Nutrilak Premium Комфорт специализированная 600г с 0месяцев,https://www.detmir.ru/product/index/id/4825559/
Смесь Nestogen Комфорт Plus 600г с 0месяцев,https://www.detmir.ru/product/index/id/5044376/
Смесь молочная Kabrita 4 Gold 800г с 18месяцев,https://www.detmir.ru/product/index/id/3590735/
Смесь Nutricia Neocate Junior 400г c 12месяцев,https://www.detmir.ru/product/index/id/3162600/
Смесь Nestle Peptamen Junior 400г с 1года,https://www.detmir.ru/product/index/id/1688781/
Смесь Nutrilak Premium безлактозная 600г с 0месяцев,https://www.detmir.ru/product/index/id/6113770/
Смесь Similac Изомил с 0 месяцев,https://www.detmir.ru/product/index/id/134742/
Смесь молочная Бибиколь Нэнни 2 на основе козьего молока 800г с 6-12месяцев,https://www.detmir.ru/product/index/id/6480644/
Смесь Nutrilak Premium антирефлюкс 350г с 0мес,https://www.detmir.ru/product/index/id/2324091/
Молочко детское Малютка 3 1200г 12 месяцев,https://www.detmir.ru/product/index/id/2870401/
Смесь молочная Nutrilak Premium 4 900г с 18месяцев,https://www.detmir.ru/product/index/id/4913701/
Пюре ФрутоНяня из цыпленка 80 г с 6 месяцев,https://www.detmir.ru/product/index/id/511741/
Смесь молочная Hipp 2 Combiotic 900г с 6месяцев,https://www.detmir.ru/product/index/id/3538054/
Cмесь Nestle Alfare Amino HMO 400г с 0месяцев,https://www.detmir.ru/product/index/id/4225701/
Смесь молочная Nutrilon 1 ГА 800г с 0месяцев,https://www.detmir.ru/product/index/id/6115329/
Пюре ФрутоНяня из индейки с овощами 100 г с 8 месяцев,https://www.detmir.ru/product/index/id/1920311/
Смесь молочная Малютка 2 1200г с 6 месяцев,https://www.detmir.ru/product/index/id/2866991/
Смесь молочная Similac Комфорт 1 750г с 0месяцев,https://www.detmir.ru/product/index/id/3344516/
Смесь PediaSure Малоежка ваниль 850г с 12месяцев,https://www.detmir.ru/product/index/id/3415084/
Смесь Nutrilak Пептиди СЦТ специализированная 350г с 0месяцев,https://www.detmir.ru/product/index/id/3175428/
Смесь Nestle Ресурс Клинутрен Юниор 400г с 12месяцев,https://www.detmir.ru/product/index/id/1419891/
Каша Fleur Alpine безмолочная овсяная 175г с 5месяцев,https://www.detmir.ru/product/index/id/134482/
Смесь молочная Hipp 3 Combiotic 900г с 10месяцев,https://www.detmir.ru/product/index/id/3538056/
Пюре ФрутоНяня из индейки 80 г с 6 месяцев,https://www.detmir.ru/product/index/id/511731/
Молочко детское Малютка 4 1200г с 18месяцев,https://www.detmir.ru/product/index/id/3419876/
Пюре ФрутоНяня из кролика 80 г с 6 месяцев,https://www.detmir.ru/product/index/id/511721/
Смесь Малютка 1 сухая молочная 1200г с 0месяцев,https://www.detmir.ru/product/index/id/2870391/
Смесь NAN PRE 400г с 0мес,https://www.detmir.ru/product/index/id/501291/
Смесь Nutrilon Пре 1 400г с 0месяцев,https://www.detmir.ru/product/index/id/6212594/
Молочко детское NAN 3 на козьем молоке 400г с 12месяцев,https://www.detmir.ru/product/index/id/3989005/
Смесь Nutrilon антирефлюкс 400г с 0 месяцев,https://www.detmir.ru/product/index/id/139422/
Смесь молочная Nutrilak Premium 1 с рождения 600г,https://www.detmir.ru/product/index/id/3020728/
Пюре ФрутоНяня из говядины 80 г с 6 месяцев,https://www.detmir.ru/product/index/id/511691/
Смесь NAN 1 400г с 0месяцев,https://www.detmir.ru/product/index/id/12371/
Пюре Бабушкино лукошко индейка 100 г с 6 мес+,https://www.detmir.ru/product/index/id/24291/
Смесь молочная Similac гипоаллергенный 2 750г с 6месяцев,https://www.detmir.ru/product/index/id/3344515/
Каша молочная Nestle овсяная груша-банан 200г с 6месяцев,https://www.detmir.ru/product/index/id/4894690/
Смесь молочная Kabrita Gold 1 400г с 0месяцев,https://www.detmir.ru/product/index/id/3209042/
Напиток Бибиколь 4 на основе козьего молока 800г с 18 месяцев,https://www.detmir.ru/product/index/id/3253546/
Молочко Similac Голд 3 800г с 12месяцев,https://www.detmir.ru/product/index/id/3117645/
Молочный напиток Nutrilon Profutura DuoBiotik 3 800г с 12месяцев,https://www.detmir.ru/product/index/id/6161736/
Пюре ФрутоНяня из телятины 80 г с 6 месяцев,https://www.detmir.ru/product/index/id/511771/
Пюре Бабушкино лукошко кролик с 6 мес+ 100 г,https://www.detmir.ru/product/index/id/24271/
Смесь молочная Nutrilak Premium 2 с 6 месяцев 600г,https://www.detmir.ru/product/index/id/3020739/
Пюре ФрутоНяня из кабачков 80 г с 4 месяцев,https://www.detmir.ru/product/index/id/1796421/
Пюре ФрутоНяня из говядины с овощами 100 г с 8 месяцев,https://www.detmir.ru/product/index/id/1920321/
Каша Fleur Alpine безмолочная гречневая гипоаллергенная 175г с 4мес,https://www.detmir.ru/product/index/id/134462/
Кашка Агуша Засыпайка молочная гречка 200мл с 6месяцев,https://www.detmir.ru/product/index/id/2268961/
Пюре Бабушкино лукошко фрикадельки индейка 100г с 12 месяцев,https://www.detmir.ru/product/index/id/707201/
Пюре ФрутоНяня из цыпленка с рисом и овощами 100 г с 8 месяцев,https://www.detmir.ru/product/index/id/511781/
Смесь сухая Nutrilon Пепти Гастро 450г с 0 месяцев,https://www.detmir.ru/product/index/id/140122/
Смесь Nutrilon Аминокислоты Syneo 400г c 0месяцев,https://www.detmir.ru/product/index/id/3668035/
"Десерт ФрутоНяня из яблок, клубники, малины 90 г с 6 месяцев",https://www.detmir.ru/product/index/id/2824931/
Пюре ФрутоНяня говядина-рис-овощи 190г с 9месяцев,https://www.detmir.ru/product/index/id/3867251/
Смесь PediaSure Малоежка клубника 850г с 12месяцев,https://www.detmir.ru/product/index/id/3415078/
Смесь сухая Nutrilak Premium гипоаллергенная 600г с 0месяцев,https://www.detmir.ru/product/index/id/4825560/
Смесь Nutrilak Premium сухая кисломолочная 350г с 0мес,https://www.detmir.ru/product/index/id/14081/
Кашка Агуша Засыпайка Рис-Яблоко-Груша 200 мл с 6 месяцев,https://www.detmir.ru/product/index/id/2268951/
Молочко Similac Голд 4 800г с 18месяцев,https://www.detmir.ru/product/index/id/3782245/
Смесь молочная Nestogen 1 600г с 0месяцев,https://www.detmir.ru/product/index/id/3277741/
Молочный напиток Бибиколь 3 на основе козьего молока 400 г с 12 мес,https://www.detmir.ru/product/index/id/134592/
Пюре ФрутоНяня цыпленок-говядина 80г с 6месяцев,https://www.detmir.ru/product/index/id/3202473/
Смесь молочная сухая Нутрилак (Nutrilak) 1 Premium на козьем молоке 600г,https://www.detmir.ru/product/index/id/6475531/
Каша молочная ФрутоНяня пшеница-яблоко-земляника 200г с 6месяцев,https://www.detmir.ru/product/index/id/6126491/
Пюре Бабушкино лукошко фрикадельки говядина 100 г с 8 месяцев,https://www.detmir.ru/product/index/id/707191/
Смесь молочная Similac гипоаллергенный 1 750г с 0месяцев,https://www.detmir.ru/product/index/id/3344514/
Каша Nestle земляника-яблоко-малина 190г с 12месяцев,https://www.detmir.ru/product/index/id/4894710/
Пюре Бабушкино лукошко говядина 100 г с 6 мес+,https://www.detmir.ru/product/index/id/23981/
Пюре ФрутоНяня телятина-овощи 100г с 8месяцев,https://www.detmir.ru/product/index/id/3590690/
Смесь NAN тройной комфорт 400г с 0мес,https://www.detmir.ru/product/index/id/1819931/
Пюре ФрутоНяня цыпленок-овощи 190г с 9месяцев,https://www.detmir.ru/product/index/id/3867252/
Каша Fleur Alpine безмолочная кукурузная с пребиотиками гипоаллергенная 175г с 5мес,https://www.detmir.ru/product/index/id/134472/
Молочная смесь Бибиколь 2 с пребиотиками на основе козьего молока 400 г с 6-12 мес,https://www.detmir.ru/product/index/id/14221/
Смесь молочная Nutrilak 2 1050г с 6месяцев,https://www.detmir.ru/product/index/id/6113766/
Смесь Nutrilak Premium соя 350 г 0мес,https://www.detmir.ru/product/index/id/2324101/
Пюре ФрутоНяня салатик из фруктов 90г с 6месяцев,https://www.detmir.ru/product/index/id/2207011/
Каша молочная Nestle мультизлаковая с фигурками из пшеницы яблоко-абрикос 190г с 12месяцев,https://www.detmir.ru/product/index/id/3513042/
Пюре Бабушкино лукошко кабачок для детей с 4 месяцев 100 г,https://www.detmir.ru/product/index/id/2623701/
Смесь Мамако 3 Premium на козьем молоке 800г с 12месяцев,https://www.detmir.ru/product/index/id/4226430/
Каша безмолочная Nutrilon гречневая 180г с 4месяцев,https://www.detmir.ru/product/index/id/3138963/
Смесь Semper Nutradefense Baby 2 молочная 400г с 6месяцев,https://www.detmir.ru/product/index/id/134292/
Молочко NAN 3 кисломолочный 400г с 12месяцев,https://www.detmir.ru/product/index/id/501251/
Пюре ФрутоНяня говядина-язык 80 г с 8 месяцев,https://www.detmir.ru/product/index/id/3011487/
Каша молочная Nestle мультизлаковая яблоко-черника-малина 200г с 6месяцев,https://www.detmir.ru/product/index/id/4894706/
Смесь Similac Комфорт 2 375г с 6месяцев,https://www.detmir.ru/product/index/id/3152647/
Каша Nestle мультизлаковая яблоко-земляника-персик 190г с 12месяцев,https://www.detmir.ru/product/index/id/4894711/
Каша Nestle мультизлаковая яблоко-банан-груша 190г с 12месяцев,https://www.detmir.ru/product/index/id/4894709/
Смесь молочная Hipp Combiotic Expert 1 600г c 0месяцев,https://www.detmir.ru/product/index/id/3396141/
Каша Агуша молочная злаки груша банан 2.7% 0.2л с6месяцев,https://www.detmir.ru/product/index/id/2992415/
Смесь Similac НеоШур с 0 месяцев,https://www.detmir.ru/product/index/id/134732/
Пюре ФрутоНяня индейка-картофель-брокколи 190г с 9месяцев,https://www.detmir.ru/product/index/id/3867254/
Пюре ФрутоНяня из тыквы 80 г с 5 месяцев,https://www.detmir.ru/product/index/id/506421/
Смесь молочная Nutrilon Premium 1 600г с 0месяцев,https://www.detmir.ru/product/index/id/2992319/
Смесь молочная Бибиколь Нэнни 1 на основе козьего молока 400г с 0-6месяцев,https://www.detmir.ru/product/index/id/6480638/
Смесь молочная Nestogen 2 600г с 6месяцев,https://www.detmir.ru/product/index/id/3277743/
Пюре ФрутоНяня из цветной капусты 80 г с 4 месяцев,https://www.detmir.ru/product/index/id/506351/
Пюре Тёма Телятина 90г с 6месяцев,https://www.detmir.ru/product/index/id/4679358/
Смесь PediaSure Малоежка шоколад 850г с 12месяцев,https://www.detmir.ru/product/index/id/3415083/
Смесь кисломолочная Nutrilon 1 350г с 0месяцев,https://www.detmir.ru/product/index/id/3486231/
Смесь кисломолочная Nutrilon 2 350г с 6месяцев,https://www.detmir.ru/product/index/id/3486232/
"Вода ФрутоНяня  артезианская питьевая негаз. 0,33 л с 0 месяцев",https://www.detmir.ru/product/index/id/20061/
Пюре ФрутоНяня овощной салатик 80 г с 5 месяцев,https://www.detmir.ru/product/index/id/506371/
Каша молочная Nestle гречка-курага 200г с 5месяцев,https://www.detmir.ru/product/index/id/4894688/
Каша Fleur Alpine безмолочная 3 злака 175г с 6месяцев,https://www.detmir.ru/product/index/id/1861671/
Пюре ФрутоНяня из яблок 90 г с 4 месяцев,https://www.detmir.ru/product/index/id/511981/
Пюре ФрутоНяня из говядины с гречкой 100 г с 8 месяцев,https://www.detmir.ru/product/index/id/511671/
Пюре ФрутоНяня из чернослива 100 г с 4 месяцев,https://www.detmir.ru/product/index/id/511791/
Молочко Nutrilon Premium 3 600г с 12месяцев,https://www.detmir.ru/product/index/id/3188484/
Напиток Бибиколь 4 на основе козьего молока 400г с 18 месяцев,https://www.detmir.ru/product/index/id/3253545/
Каша молочная Nestle пшеница-тыква 200г с 5месяцев,https://www.detmir.ru/product/index/id/4894707/
"Сок ФрутоНяня из яблок 0,2 л с 4 месяцев",https://www.detmir.ru/product/index/id/578181/
Смесь молочная Nutrilon Комфорт 1 400г с 0 месяцев,https://www.detmir.ru/product/index/id/139972/
Смесь молочная Nutrilon Premium 2 600г с 6месяцев,https://www.detmir.ru/product/index/id/2992320/
Молочко Similac Классик 3 600г с 12месяцев,https://www.detmir.ru/product/index/id/3157299/
Пюре ФрутоНяня фруктовый салатик 100 г с 5 месяцев,https://www.detmir.ru/product/index/id/511891/
Каша молочная Агуша злаки черника-малина-яблоко 2.7% 200мл с 6месяцев,https://www.detmir.ru/product/index/id/5086448/
Каша жидкая Агуша Засыпай-ка молочно-злаковая 200г с 6месяцев,https://www.detmir.ru/product/index/id/6255924/
Пюре Бабушкино лукошко цыпленок с 6 мес+ 100 г,https://www.detmir.ru/product/index/id/24451/
Смесь молочная Nutrilak 1 1050г с 0месяцев,https://www.detmir.ru/product/index/id/6113765/
Смесь сухая Nutrilon Пепти аллергия 400г с 0 месяцев,https://www.detmir.ru/product/index/id/134902/
Каша молочная Nestle мультизлаковая яблоко-банан 200г с 6месяцев,https://www.detmir.ru/product/index/id/4894702/
Смесь молочная сухая Нутрилак (Nutrilak) 2 Premium на козьем молоке 600г,https://www.detmir.ru/product/index/id/6475533/
"Кашка ФрутоНяня молочная овсяная с бананом 0,2 л с 6 месяцев",https://www.detmir.ru/product/index/id/1060571/
Пюре Бабушкино лукошко треска-картофель для детей с 8 месяцев 100 г,https://www.detmir.ru/product/index/id/24411/
Смесь молочная Nutrilak Premium 3 с 12 месяцев 600г,https://www.detmir.ru/product/index/id/3020754/
Каша молочная Nestle мультизлаковая груша-персик 200г с 6месяцев,https://www.detmir.ru/product/index/id/4894703/
Печенье Fleur Alpine яблочный сок 120г с 6месяцев,https://www.detmir.ru/product/index/id/4956447/
Печенье Fleur Alpine грушевый сок 120г с 6 месяцев,https://www.detmir.ru/product/index/id/4956146/
Пюре ФрутоНяня из брокколи 80 г с 4 месяцев,https://www.detmir.ru/product/index/id/506361/
Пюре Тёма Индейка 90г с 6месяцев,https://www.detmir.ru/product/index/id/4679359/
Пюре Бабушкино лукошко горбуша-картофель 100г с 8месяцев,https://www.detmir.ru/product/index/id/24061/
Пюре ФрутоНяня кукуруза-тыква-морковь 110г с 5месяцев,https://www.detmir.ru/product/index/id/6176779/
Смесь молочная Малютка Комфорт Pro с 0 месяцев 900г,https://www.detmir.ru/product/index/id/6536556/
Пюре Бабушкино лукошко овощное с индейкой и рисом 190г с 9 месяцев,https://www.detmir.ru/product/index/id/3141230/
Молочко детское Nutrilon Premium 4 600г с 18месяцев,https://www.detmir.ru/product/index/id/3188485/
Каша молочная Nestle мультизлаковая банан-земляника 200г с 8месяцев,https://www.detmir.ru/product/index/id/4894705/
Смесь Nutrilak Premium Комфорт сухая специализированная 350г с 0месяцев,https://www.detmir.ru/product/index/id/3506299/
Пюре Бабушкино лукошко цветная капуста для детей с 4 месяцев 100 г,https://www.detmir.ru/product/index/id/24361/
Пюре ФрутоНяня из яблок 100 г с 4 месяцев,https://www.detmir.ru/product/index/id/511971/
Пюре ФрутоНяня Мой первый салатик 80 г с 5 месяцев,https://www.detmir.ru/product/index/id/2458951/
Пюре Тёма Цыпленок 90г с 6месяцев,https://www.detmir.ru/product/index/id/4679171/
