Наименование товара,Ссылка на товар
Пюре ОМКК Малыш-крепыш 100г с 6месяцев,https://www.detmir.ru/product/index/id/3972308/
Пюре ОМКК мясо индейки с сердцем 100г с 8месяцев,https://www.detmir.ru/product/index/id/3972310/
Пюре ОМКК Забияка 100г с 6месяцев,https://www.detmir.ru/product/index/id/3972311/
Пюре ОМКК из говядины и свинины 100г с 6месяцев,https://www.detmir.ru/product/index/id/3972312/
Пюре ОМКК свинина с печенью 100г с 8месяцев,https://www.detmir.ru/product/index/id/3972314/
Пюре ОМКК говядина с мясом цыплят 100г с 6месяцев,https://www.detmir.ru/product/index/id/3972318/
Пюре ОМКК кролик-говядина 90г с 6месяцев,https://www.detmir.ru/product/index/id/3972320/
Пюре Маленькое счастье говядина-язык 80г с 8месяцев,https://www.detmir.ru/product/index/id/3972415/
Пюре Маленькое счастье мясное ассорти 110г с 8месяцев,https://www.detmir.ru/product/index/id/3972863/
Пюре Маленькое счастье цыпленок 110г с 6месяцев,https://www.detmir.ru/product/index/id/3972864/
Пюре Маленькое счастье говядина-печень 110г с 8месяцев,https://www.detmir.ru/product/index/id/3972865/
Пюре Маленькое счастье индейка-печень 110г с 8месяцев,https://www.detmir.ru/product/index/id/3972866/
Хлопья овсяные Сташевское без глютена клубника 375г,https://www.detmir.ru/product/index/id/3976755/
Хлопья овсяные Сташевское без глютена шоколад 375г,https://www.detmir.ru/product/index/id/3976756/
Хлопья овсяные Сташевское без глютена яблоко 375г,https://www.detmir.ru/product/index/id/3976757/
Хлопья овсяные Сташевское без глютена вишня 375г,https://www.detmir.ru/product/index/id/3976758/
Хлопья овсяные Сташевское без глютена мед 375г,https://www.detmir.ru/product/index/id/3976759/
Хлопья овсяные Сташевское без глютена малина 375г,https://www.detmir.ru/product/index/id/3976760/
Гранола Ufeelgood Антистресс шоколадная 200г,https://www.detmir.ru/product/index/id/3976795/
Гранола Ufeelgood Настроение 200г,https://www.detmir.ru/product/index/id/3976796/
Гранола Ufeelgood Детокс 200г,https://www.detmir.ru/product/index/id/3976797/
Гранола Ufeelgood Красота сладкая 200г,https://www.detmir.ru/product/index/id/3976798/
Гранола Ufeelgood Восстановление 200г,https://www.detmir.ru/product/index/id/3976799/
Гранола Ufeelgood Безглютеновая 200г,https://www.detmir.ru/product/index/id/3976800/
Сок ФрутоНяня яблоко-черноплодная рябина-малина-черная смородина-шиповник осветленный 0.2л с 5месяцев,https://www.detmir.ru/product/index/id/4018743/
Печенье детское КотМарКот Frolla Montata c абрикосом и Абрикос+Шоколад,https://www.detmir.ru/product/index/id/4031435/
Печенье детское КотМарКот Абрикос+шоколад и Мята+шоколад,https://www.detmir.ru/product/index/id/4031436/
Печенье детское КотМарКот Абрикос+шоколад и Сабле с лавандой,https://www.detmir.ru/product/index/id/4031437/
Печенье детское КотМарКот Ассорти Нежность и Ассорти Шоколад,https://www.detmir.ru/product/index/id/4031438/
Печенье детское КотМарКот Бискотти итальянские и Овсяное для всей семьи,https://www.detmir.ru/product/index/id/4031439/
Печенье детское КотМарКот Кокос и Лаванда,https://www.detmir.ru/product/index/id/4031440/
Печенье детское КотМарКот Мята+шоколад и Кокосовое сердце,https://www.detmir.ru/product/index/id/4031441/
Печенье детское КотМарКот Мята+шоколад и Французское,https://www.detmir.ru/product/index/id/4031442/
Печенье детское КотМарКот Овсяное и Кокосовое,https://www.detmir.ru/product/index/id/4031443/
Печенье детское КотМарКот Овсяное и Орех+шоколад,https://www.detmir.ru/product/index/id/4031444/
Печенье детское КотМарКот Орех+шоколад и Мята+шоколад,https://www.detmir.ru/product/index/id/4031445/
Пюре Дары Кубани из яблок и черники с печеньем 90г 6месяцев,https://www.detmir.ru/product/index/id/4033447/
Чай Алтайский кедр Матушка лактогонный 60 гр,https://www.detmir.ru/product/index/id/4033826/
Вода питьевая Мика-Мика Природная для детей 0.5 л / 12 шт в упаковке,https://www.detmir.ru/product/index/id/4033872/
Вода питьевая Мика-Мика Природная для детей 5 л / 2 шт в упаковке,https://www.detmir.ru/product/index/id/4037907/
Вода питьевая Мика-Мика Природная для детей 0.33 литра / 12шт в упаковке,https://www.detmir.ru/product/index/id/4037908/
Вода питьевая Мика-Мика Природная для детей 1.5 литра / 6 шт в упаковке,https://www.detmir.ru/product/index/id/4037909/
Каша Goattiny кукурузно-рисовая с бананом на козьем молоке 200 г,https://www.detmir.ru/product/index/id/4037928/
Каша Goattiny многозерновая с черникой на козьем молоке 200 г,https://www.detmir.ru/product/index/id/4037929/
Каша Goattiny пшенично-рисовая с персиком на козьем молоке 200 г,https://www.detmir.ru/product/index/id/4037990/
Каша Goattiny рисовая на козьем молоке 200 г,https://www.detmir.ru/product/index/id/4037991/
Печенье детское КотМарКот Ассорти №3 Нежность,https://www.detmir.ru/product/index/id/4041151/
Печенье детское КотМарКот Абрикос и Шоколад,https://www.detmir.ru/product/index/id/4041152/
Печенье детское КотМарКот Французское с базиликом,https://www.detmir.ru/product/index/id/4041153/
Печенье детское КотМарКот Сабле с лавандой,https://www.detmir.ru/product/index/id/4041181/
Печенье детское КотМарКот Frolla Montata c абрикосом,https://www.detmir.ru/product/index/id/4041182/
Печенье детское КотМарКот Ассорти №1 Примавера,https://www.detmir.ru/product/index/id/4041183/
Печенье детское КотМарКот Ассорти Шоколад,https://www.detmir.ru/product/index/id/4041184/
Печенье детское КотМарКот Кокосовое сердце,https://www.detmir.ru/product/index/id/4041185/
Печенье детское КотМарКот Мята и Шоколад,https://www.detmir.ru/product/index/id/4041186/
Печенье детское КотМарКот Бискотти Итальянские,https://www.detmir.ru/product/index/id/4041187/
Печенье детское КотМарКот Клюква и Орех Овсяное,https://www.detmir.ru/product/index/id/4041188/
Печенье детское КотМарКот Орех и Шоколад,https://www.detmir.ru/product/index/id/4041189/
Печенье детское КотМарКот Полезные Бискотти,https://www.detmir.ru/product/index/id/4041190/
Печенье детское КотМарКот Бискотти итальянские и Frolla Montata,https://www.detmir.ru/product/index/id/4041191/
Хлопья Диетика гречневые 300г D10-11,https://www.detmir.ru/product/index/id/4047104/
Хлопья Диетика кукурузные 300г D10-12,https://www.detmir.ru/product/index/id/4047105/
Хлопья Диетика овсяные 300г D10-10,https://www.detmir.ru/product/index/id/4047106/
Хлопья Любятово Кукурузные 600г,https://www.detmir.ru/product/index/id/4049847/
Готовый завтрак Kelloggs Набор 3 шт по 200г Карамельные лапы,https://www.detmir.ru/product/index/id/4053097/
Готовый завтрак Kelloggs Набор 3 шт по 220г Подушечки c нежной шоколадно-молочной начинкой,https://www.detmir.ru/product/index/id/4053098/
Готовый завтрак Kelloggs Банановые лапы 3 шт по 200г,https://www.detmir.ru/product/index/id/4053099/
Готовый завтрак Kelloggs Набор 3 шт по 195г Радужные колечки с фруктовым вкусом,https://www.detmir.ru/product/index/id/4053100/
Готовый завтрак Kelloggs Набор 3 шт по 220г Подушечки c нежной шоколадно-ореховой начинкой,https://www.detmir.ru/product/index/id/4053101/
Готовый завтрак Kelloggs Хрустящая Гранола-Мюсли с молочным шоколадом 300г,https://www.detmir.ru/product/index/id/4053102/
Готовый завтрак Kelloggs Хрустящая Гранола-Мюсли с орехами и фруктами ягодами 300г,https://www.detmir.ru/product/index/id/4053146/
Готовый завтрак Kelloggs Хрустящая Гранола-Мюсли с темным шоколадом и фундуком 300г,https://www.detmir.ru/product/index/id/4053147/
Готовый завтрак Kelloggs Набор 3 шт по 220г Шоколадные лапы и клыки,https://www.detmir.ru/product/index/id/4053148/
Хлопья Любятово Мультизлаковые 450г,https://www.detmir.ru/product/index/id/4053152/
Пюре мясное Rudolfs Цыплёнок 120гр*6шт,https://www.detmir.ru/product/index/id/4054897/
Пюре мясное Rudolfs Ягнёнок 120гр*6шт,https://www.detmir.ru/product/index/id/4054898/
Пюре фруктовое Rudolfs Яблоко-Груша 190гр*6шт,https://www.detmir.ru/product/index/id/4054901/
Пюре Беллакт из банана 100г с 6 месяцев 12 шт,https://www.detmir.ru/product/index/id/4061957/
Пюре Беллакт из груш и абрикосов 100г с 5 месяцев 12 шт,https://www.detmir.ru/product/index/id/4061958/
Пюре Беллакт из груш и черники с козьим молоком 80г с 6 месяцев 12 шт,https://www.detmir.ru/product/index/id/4061959/
Пюре Беллакт из груш с козьим молоком 80г с 6 месяцев 12 шт,https://www.detmir.ru/product/index/id/4061960/
Пюре Беллакт из груш 100г с 4 месяцев 12 шт,https://www.detmir.ru/product/index/id/4061961/
Пюре Беллакт из груш 80г с 4 месяцев 12 шт,https://www.detmir.ru/product/index/id/4061962/
Детский чай Когда Я вырасту гранулированный 85 г Малина-шиповник с витамином С 8 шт,https://www.detmir.ru/product/index/id/4062054/
Детский чай Когда Я вырасту гранулированный 85 г Манго с апельсином 8 шт,https://www.detmir.ru/product/index/id/4062055/
Детский чай Когда Я вырасту гранулированный 85 г Облепиха с мёдом 8 шт,https://www.detmir.ru/product/index/id/4062056/
Детский чай Когда Я вырасту гранулированный 85 г Спокойный животик 8 шт,https://www.detmir.ru/product/index/id/4062057/
Пюре фруктовое Когда Я вырасту Яблоко манго ананас 6 шт,https://www.detmir.ru/product/index/id/4062058/
Пюре фруктовое Когда Я вырасту Яблоко манго банан киви 6 шт,https://www.detmir.ru/product/index/id/4062059/
Пюре фруктовое Когда Я вырасту Яблоко манго банан маракуйя 6 шт,https://www.detmir.ru/product/index/id/4062060/
Пюре фруктовое Когда Я вырасту Яблоко манго киви апельсин 6 шт,https://www.detmir.ru/product/index/id/4062061/
Пюре фруктовое Когда Я вырасту Яблоко манго малина 6 шт,https://www.detmir.ru/product/index/id/4062062/
Пюре Беллакт из кабачков без сахара 100г с 4 месяцев 18 шт,https://www.detmir.ru/product/index/id/4062063/
Пюре Беллакт из капусты брокколи 80г с 4 месяцев 12 шт,https://www.detmir.ru/product/index/id/4062064/
Пюре Беллакт из капусты брокколи 100г с 4 месяцев 12 шт,https://www.detmir.ru/product/index/id/4062065/
Пюре Беллакт из персиков 100г с 4 месяцев 12 шт,https://www.detmir.ru/product/index/id/4062066/
Пюре Беллакт из персиков 80г с 4 месяцев 12 шт,https://www.detmir.ru/product/index/id/4062067/
Пюре Беллакт из яблок и клубники с козьим молоком 80г с 6 месяцев 12 шт,https://www.detmir.ru/product/index/id/4062080/
Пюре Беллакт из яблок и персиков 100г с 5 месяцев 12 шт,https://www.detmir.ru/product/index/id/4062081/
Пюре Беллакт из яблок и персиков Gualapack 90г с 5 месяцев 24 шт,https://www.detmir.ru/product/index/id/4062082/
Пюре Беллакт из яблок с козьим молоком 80г с 6 месяцев 12 шт,https://www.detmir.ru/product/index/id/4062083/
Пюре Беллакт из яблок с творогом 100г с 6 месяцев 12 шт,https://www.detmir.ru/product/index/id/4062084/
Пюре Беллакт из яблок 100г с 4 месяцев 12 шт,https://www.detmir.ru/product/index/id/4062085/
Пюре Беллакт из яблок 80г с 4 месяцев 12 шт,https://www.detmir.ru/product/index/id/4062086/
Пюре Беллакт из яблок Gualapack 90г с 4 месяцев 24 шт,https://www.detmir.ru/product/index/id/4062087/
Пюре Беллакт из груш малины и клубники 100г с 6 месяцев 12 шт,https://www.detmir.ru/product/index/id/4062088/
Пюре Беллакт из груш черники и малины 100г с 5 месяцев 12 шт,https://www.detmir.ru/product/index/id/4062089/
Пюре Беллакт из кабачков 80г с 4 месяцев 12 шт,https://www.detmir.ru/product/index/id/4062090/
Пюре Беллакт из персиков и груш 100г с 5 месяцев 12 шт,https://www.detmir.ru/product/index/id/4062098/
Пюре Беллакт из слив 100г с 4 месяцев 12 шт,https://www.detmir.ru/product/index/id/4062099/
Пюре Беллакт из цветной капусты 100г с 4 месяцев 12 шт,https://www.detmir.ru/product/index/id/4062100/
Пюре Беллакт из цветной капусты 80г с 4 месяцев 12 шт,https://www.detmir.ru/product/index/id/4062101/
Пюре Беллакт из чернослива Gualapack 90г с 4 месяцев 24 шт,https://www.detmir.ru/product/index/id/4062102/
Пюре Беллакт из чернослива 100г с 4 месяцев 12 шт,https://www.detmir.ru/product/index/id/4062103/
Пюре Беллакт из чернослива 80г с 4 месяцев 12 шт,https://www.detmir.ru/product/index/id/4062104/
Пюре Беллакт из яблок и абрикосов 100г с 5 месяцев 12 шт,https://www.detmir.ru/product/index/id/4062105/
Пюре Беллакт из яблок и банана Gualapack 90г с 6 месяцев 24 шт,https://www.detmir.ru/product/index/id/4062106/
Пюре Беллакт из яблок и бананов со сливками 100г с 6 месяцев 12 шт,https://www.detmir.ru/product/index/id/4062107/
Пюре Беллакт из яблок и бананов 100г с 6 месяцев 12 шт,https://www.detmir.ru/product/index/id/4062108/
Пюре Беллакт из яблок и груш с творогом 100г с 6 месяцев 12 шт,https://www.detmir.ru/product/index/id/4062109/
Пюре Беллакт из яблок и груш 100г с 5 месяцев 12 шт,https://www.detmir.ru/product/index/id/4062110/
Пюре Беллакт морковное без сахара 100г с 4 месяцев 18 шт,https://www.detmir.ru/product/index/id/4062118/
Пюре Беллакт Овощное ассорти из брокколи цветной капусты и кабачков 170г с 5 месяцев 18 шт,https://www.detmir.ru/product/index/id/4062119/
Пюре Беллакт Овощной салатик из цветной капусты картофеля и тыквы 170г с 5 месяцев 18 шт,https://www.detmir.ru/product/index/id/4062120/
Пюре Беллакт тыквенное без сахара 100г с 5 месяцев 18 шт,https://www.detmir.ru/product/index/id/4062121/
Пюре Беллакт Фруктово-сливочный десерт из банана и клубники со сливками 170г 18 шт,https://www.detmir.ru/product/index/id/4062122/
Пюре Беллакт Фруктово-творожный десерт из яблок и банана со сливками и творогом 170г 18 шт,https://www.detmir.ru/product/index/id/4062123/
Пюре Беллакт Фруктово-ягодный коктейль из груш банана и малины 170г 18 шт,https://www.detmir.ru/product/index/id/4062124/
Пюре Беллакт Фруктовый салатик из банана груш и яблок Gualapack 90г с 6 месяцев 24 шт,https://www.detmir.ru/product/index/id/4062125/
Пюре Heinz макарошки с говядинкой 90г с 8месяцев,https://www.detmir.ru/product/index/id/4086832/
Готовый завтрак Здоровей шарики кукурузные со вкусом шоколада без глютена 250 гр,https://www.detmir.ru/product/index/id/4086889/
Сухой завтрак Здоровей Шарики гречишно-рисовые без сахара без глютена 30 гр,https://www.detmir.ru/product/index/id/4086895/
Сухой завтрак Здоровей Шарики из зеленой гречки без сахара без глютена 30 гр,https://www.detmir.ru/product/index/id/4086906/
Сухой завтрак Здоровей Шарики кукурузные без сахара без глютена 30 гр,https://www.detmir.ru/product/index/id/4086907/
Сухой завтрак Здоровей Шарики рисовые без сахара без глютена 30 гр,https://www.detmir.ru/product/index/id/4086908/
Сухой завтрак Здоровей Шарики с горохом без сахара без глютена 30 гр,https://www.detmir.ru/product/index/id/4086909/
Сухой завтрак Здоровей Шарики с фасолью без сахара без глютена 30 гр,https://www.detmir.ru/product/index/id/4086910/
Вода питьевая БАЙКАЛИКА Набор 12 бутылок по 0.5 л природная глубинная негазированная,https://www.detmir.ru/product/index/id/4094055/
Вода питьевая БАЙКАЛИКА Набор 6 бутылок по 1.25л природная глубинная негазированная,https://www.detmir.ru/product/index/id/4094056/
Сухой завтрак MILZU Звездочки с клюквенным сиропом натуральный 300 г,https://www.detmir.ru/product/index/id/4094057/
Сухой завтрак MILZU Зерна злаковые с какао BIO натуральный 200 г,https://www.detmir.ru/product/index/id/4094058/
Сухой завтрак MILZU Ржаные хлопья без сахара BIO натуральный 300г,https://www.detmir.ru/product/index/id/4094059/
Сухой завтрак MILZU Хлопья злаковые с какао натуральный 250 г,https://www.detmir.ru/product/index/id/4094060/
Вода Baikal Байкальская глубинная негазированная 0.45 л 12 шт,https://www.detmir.ru/product/index/id/4094179/
Вода Baikal Байкальская глубинная негазированная 0.85 л 6 шт,https://www.detmir.ru/product/index/id/4094359/
Сухой завтрак MILZU Колечки с клюквенным сиропом натуральный 400 г,https://www.detmir.ru/product/index/id/4103381/
Сухой завтрак MILZU Колечки злаковые с какао 200 г,https://www.detmir.ru/product/index/id/4103382/
Сухой завтрак MILZU Шарики злаковые с медом 200 г,https://www.detmir.ru/product/index/id/4103383/
Сухой завтрак MILZU Злаковые колечки с медом Organic Bio 200,https://www.detmir.ru/product/index/id/4103384/
Каша детская TOLOKNOFF из овсяного толокна с молоком 250г,https://www.detmir.ru/product/index/id/4111594/
Каша детская TOLOKNOFF из овсяного толокна с молоком и бананом 220г,https://www.detmir.ru/product/index/id/4111595/
Хлопья кукурузные Schaer без глютена 250г,https://www.detmir.ru/product/index/id/4111694/
Пюре Беллакт из яблок и клюквы 100г с 5 месяцев 12 шт,https://www.detmir.ru/product/index/id/4113529/
Пюре Беллакт Фруктово-сливочный десерт из банана и клубники со сливками Gualapack с 6 месяцев 90г,https://www.detmir.ru/product/index/id/4113713/
Пюре Беллакт из груш Gualapack 90г с 4 месяцев 24 шт,https://www.detmir.ru/product/index/id/4113714/
Пюре Беллакт Фруктово-ягодный коктейль из груш банана и малины Gualapack 90г с 6 месяцев 24 шт,https://www.detmir.ru/product/index/id/4113715/
Консервы ОМКК мясо индейки с печенью 100г с 8месяцев,https://www.detmir.ru/product/index/id/4119270/
Консервы ОМКК Ладушки мясные 100г с 6месяцев,https://www.detmir.ru/product/index/id/4119271/
Пюре Маленькое счастье мясное ассорти с печенью 80г с 8месяцев,https://www.detmir.ru/product/index/id/4125421/
Пюре Маленькое счастье лазанья 100г с 12месяцев,https://www.detmir.ru/product/index/id/4125422/
Пюре Маленькое счастье ризотто 100г с 12месяцев,https://www.detmir.ru/product/index/id/4125423/
Готовый завтрак Умная мама Хрумпы из полбы классические без сахара 110г,https://www.detmir.ru/product/index/id/4125972/
Готовый завтрак Умная мама Хрумпы из полбы с какао и тростниковым сахаром 140г,https://www.detmir.ru/product/index/id/4125973/
Хлопья Умная мама из полбы цельнозерновые 300г,https://www.detmir.ru/product/index/id/4150487/
Хлопья Умная мама зеленой гречки цельнозерновые 300г,https://www.detmir.ru/product/index/id/4150488/
Вода питьевая Geo natura Природная Родниковая 0.5л 12 шт в упаковке,https://www.detmir.ru/product/index/id/4196670/
Вода питьевая Geo natura Природная Родниковая 1.0л 6 шт в упаковке,https://www.detmir.ru/product/index/id/4196671/
Кисель Фитодар Плодово-ягодный витаминизированный 200гр,https://www.detmir.ru/product/index/id/4210507/
Какао Какао-Панда 500 гр,https://www.detmir.ru/product/index/id/4210564/
Какао Какао-Панда 250 гр,https://www.detmir.ru/product/index/id/4210565/
Какао Какао-Панда витаминизированный 150 гр,https://www.detmir.ru/product/index/id/4210566/
Кисель Фитодар Плодово-ягодный с кусочками фруктов 150 гр,https://www.detmir.ru/product/index/id/4210567/
Кисель Фитодар Черничный витаминизированный 200гр,https://www.detmir.ru/product/index/id/4210568/
Кисель Фитодар Облепиховый витаминизированный 200гр,https://www.detmir.ru/product/index/id/4210569/
