Наименование товара,Ссылка на товар
Чай детский Травник Гордеев М.В при сухом или смешанном кашле 1.5 гр 20 фильтр пакет,https://www.detmir.ru/product/index/id/6222089/
Пюре Heinz соте тыква-курочка 120г с 6месяцев,https://www.detmir.ru/product/index/id/1012771/
Макароны детские Pasta la Bella Baby Звездочки триколор,https://www.detmir.ru/product/index/id/4289871/
Хлопья Агро-Альянс из зеленой гречки,https://www.detmir.ru/product/index/id/4758432/
Пюре Gerber морковь 80г,https://www.detmir.ru/product/index/id/500871/
Пюре Gerber рагу телятина-овощи 190г с 8месяцев,https://www.detmir.ru/product/index/id/591201/
Сухой завтрак Сладкая сказка CRUNCH TIME Ми-Ми-Мишки 170г,https://www.detmir.ru/product/index/id/6340402/
Чай Consumed Спокойный малыш 20 пакетов по 1.5г,https://www.detmir.ru/product/index/id/5107946/
"Каша ФрутоНяня молочная мультизлаковая с яблоком, бананом и земляникой 200 г с 6 месяцев",https://www.detmir.ru/product/index/id/1796401/
Смесь Nutrilak Соя 200мл с 0месяцев,https://www.detmir.ru/product/index/id/3200855/
Пюре ФрутоKids яблоко-персик-морковь-апельсин 90г с 6месяцев,https://www.detmir.ru/product/index/id/3496809/
Каша молочная Bebi Premium 5 злаков малина-абрикос 200г с 6месяцев,https://www.detmir.ru/product/index/id/4778082/
Чай детский травяной Здоровье Отвар шиповника Профессор Травкин,https://www.detmir.ru/product/index/id/5012320/
Макароны детские Pasta la Bella Baby триколор,https://www.detmir.ru/product/index/id/4237972/
Каша молочная Bebelac Мультизлаковая с яблоком и малиной 200г c 6месяцев,https://www.detmir.ru/product/index/id/4682098/
Чай детский травяной Здоровье Укропная водичка Профессор Травкин,https://www.detmir.ru/product/index/id/5027800/
Напиток чайный детский Белтея Укропная водичка 20 фильтр-пакетов по 1г Х 2 шт,https://www.detmir.ru/product/index/id/5094452/
Напиток чайный детский Белтея Баю-бай 20 фильтр-пакетов по 1г х 2 шт,https://www.detmir.ru/product/index/id/5094453/
Пюре овощное Беллакт из кабачков 100г Х3 шт.,https://www.detmir.ru/product/index/id/5098530/
Каша детская Baby King Organic безмолочная рисово-кукурузная с бананом 175гр с 6 месяцев,https://www.detmir.ru/product/index/id/5141770/
Напиток безалкогольный Маша и Медведь вишня 0.75л,https://www.detmir.ru/product/index/id/6309385/
Каша молочная Nestle мультизлаковая банан-земляника 220г с 8месяцев,https://www.detmir.ru/product/index/id/3187789/
Пюре ОМКК Уплетай-ка говядина элитная 100г с 6месяцев,https://www.detmir.ru/product/index/id/6127937/
Каша безмолочная Bebelac рисовая 180г c 4месяцев,https://www.detmir.ru/product/index/id/4682096/
Каша молочная Nestle пшеничная яблоко-земляника 220г с 8месяцев,https://www.detmir.ru/product/index/id/3187793/
Макароны детские Смешарики со шпинатом,https://www.detmir.ru/product/index/id/4398847/
Макароны детские Смешарики триколор,https://www.detmir.ru/product/index/id/4398850/
Пюре фруктовое Беллакт из яблок и клюквы 100г х 3 шт,https://www.detmir.ru/product/index/id/5095283/
Каша детская Baby King Organic безмолочная рисовая 175гр с 4 месяцев,https://www.detmir.ru/product/index/id/5141771/
Напиток чайный детский Белтея Укрепляйка 20 фильтр-пакетов по 1г х 2шт,https://www.detmir.ru/product/index/id/5101499/
Пюре Gerber груша Вильямс 80г,https://www.detmir.ru/product/index/id/512031/
Каша детская Baby King безмолочная рисовая с пребиотиками 200гр с 4 месяцев,https://www.detmir.ru/product/index/id/5141534/
Чай детский травяной Здоровье Микстура при кашле с алтеем Профессор Травкин,https://www.detmir.ru/product/index/id/5012066/
Каша молочная Nestle пшеничная с тыквой 220г с 6месяцев,https://www.detmir.ru/product/index/id/3187792/
Пюре Бибиколь мюсли с ананасом киноа и йогуртом из козьего молока 190г с 8месяцев,https://www.detmir.ru/product/index/id/3142549/
Мюсли ОлЛайт медовые шоколадные с орехами 60г,https://www.detmir.ru/product/index/id/3422261/
Напиток чайный детский Белтея Ромашка 20 фильтр-пакетов по 1г х 2 шт,https://www.detmir.ru/product/index/id/5094454/
Пюре Heinz яблоко-груша-творог 90г с 6месяцев,https://www.detmir.ru/product/index/id/3228762/
Гранола ПП Правильное питание без сахара орехи-клюква 350г,https://www.detmir.ru/product/index/id/3965646/
Каша молочная Nestle гречневая с курагой 220г с 6месяцев,https://www.detmir.ru/product/index/id/3187786/
Пюре Gerber цыплёнок 80 г с 6 месяцев,https://www.detmir.ru/product/index/id/2796861/
Пюре Gerber кролик 80г с 6месяцев,https://www.detmir.ru/product/index/id/3112493/
Каша безмолочная Беллакт зерновая овсяная с пребиотиком 200 г,https://www.detmir.ru/product/index/id/6111306/
Пюре ОМКК Уплетай-ка мясо индейки-печень 100г с 8месяцев,https://www.detmir.ru/product/index/id/6127942/
Пюре Тёма горбуша-овощи-рис 80г с 8месяцев,https://www.detmir.ru/product/index/id/3506033/
Фиточай Калина Непростужайка детский №20 х 2 шт,https://www.detmir.ru/product/index/id/4073020/
Пюре Gerber цветная капуста 80г,https://www.detmir.ru/product/index/id/500991/
Пюре фруктовое Беллакт из яблок и персиков 100г Х3 шт.,https://www.detmir.ru/product/index/id/5098526/
Хлопья Агро-Альянс 4 злака,https://www.detmir.ru/product/index/id/4758434/
Каша Nestle молочная гречневая c бифидобактериями с 4 месяцев,https://www.detmir.ru/product/index/id/2927911/
Каша молочная Heinz кукурузная 200г с 5месяцев,https://www.detmir.ru/product/index/id/3148972/
Сухой завтрак Здоровей шарики кукурузные без сахара 30 грамм,https://www.detmir.ru/product/index/id/6068876/
Смузи Ложка в ладошке Hot Wheels яблоко-банан-клубника 115г с 6месяцев в ассортименте,https://www.detmir.ru/product/index/id/3869199/
Чай Фармацветик травяной детский для спокойного сна 20пакетиков,https://www.detmir.ru/product/index/id/3967522/
Макароны детские Pasta la Bella Вермишелька яичная Baby,https://www.detmir.ru/product/index/id/4290108/
Пюре Semper индейка-рис 125г с 6месяцев,https://www.detmir.ru/product/index/id/454411/
Сок Gerber яблоко груша 0.175л с 4месяцев,https://www.detmir.ru/product/index/id/500931/
Пюре Маленькое счастье Цветная капуста 80г х 3 шт,https://www.detmir.ru/product/index/id/6003764/
Каша молочная Heinz овсяная 200 г с 5 месяцев,https://www.detmir.ru/product/index/id/3148983/
Каша молочная Heinz кукурузная 180г с 5месяцев,https://www.detmir.ru/product/index/id/4004574/
Пюре фруктовое Беллакт из яблок и груш 100г Х3 шт.,https://www.detmir.ru/product/index/id/5098640/
Пюре фруктовое Беллакт яблочное 100г х 3 шт,https://www.detmir.ru/product/index/id/5098952/
Каша молочная Heinz гречневая 200г с 4месяцев,https://www.detmir.ru/product/index/id/3148967/
Пюре Тёма Говядина с гречкой 100 г,https://www.detmir.ru/product/index/id/501791/
Пюре Маленькое счастье Яблоко-Персик 90г х 3 шт,https://www.detmir.ru/product/index/id/5149945/
Каша Винни безмолочная рис-яблоко-пребиотик 200г 4месяцев,https://www.detmir.ru/product/index/id/2992091/
Каша молочная Heinz рисовая 200г с 4месяцев,https://www.detmir.ru/product/index/id/3148982/
Пюре ФрутоНяня хек 80г с 8месяцев,https://www.detmir.ru/product/index/id/3224722/
Мюсли Bionova Crunchy яблочные 60 г,https://www.detmir.ru/product/index/id/3422209/
Пюре Gerber 4 фрукта пауч 90г с 6месяцев,https://www.detmir.ru/product/index/id/680611/
Пюре Тёма Говядина с кабачками и рисом 100 г,https://www.detmir.ru/product/index/id/501761/
Пюре фруктовое Беллакт из груш и абрикосов 100г Х3 шт.,https://www.detmir.ru/product/index/id/5098527/
Пюре Heinz яблоко-персик-сливки 90г с 6месяцев,https://www.detmir.ru/product/index/id/3228764/
Нектар ФрутоНяня смесь фруктов-манго 0.5л с 3лет,https://www.detmir.ru/product/index/id/3707734/
Хлопья Агро-Альянс овсяные №2 (средний размер) 400г,https://www.detmir.ru/product/index/id/4758421/
Пюре Тёма Цыпленок с говядиной 100 г,https://www.detmir.ru/product/index/id/501781/
Пюре Маленькое счастье Тыква 90 гр,https://www.detmir.ru/product/index/id/6195012/
Пюре ФрутоНяня яблоко-малина-ежевика-мюсли 90г с 6месяцев,https://www.detmir.ru/product/index/id/3897999/
Пюре Gerber яблоко и свекла 125г с 5месяцев,https://www.detmir.ru/product/index/id/3177418/
Пюре Gerber яблоко и малина 125г с 5месяцев,https://www.detmir.ru/product/index/id/3177422/
Пюре овощное Беллакт из тыквы 100г Х3 шт.,https://www.detmir.ru/product/index/id/5098531/
Хлопья FITROO кукурузные 200г,https://www.detmir.ru/product/index/id/6237792/
Каша ФрутоНяня молочная рисовая с тыквой и абрикосами 200 г с 5 месяцев,https://www.detmir.ru/product/index/id/138282/
"Каша ФрутоНяня молочная мультизлаковая с яблоком, смородиной и вишней 200 г с 6 месяцев",https://www.detmir.ru/product/index/id/1796411/
Каша ФрутоНяня молочная мультизлаковая 200г с 6 месяцев,https://www.detmir.ru/product/index/id/511501/
"Нектар ФрутоНяня из тыквы 0,5 л от 3 лет",https://www.detmir.ru/product/index/id/577551/
Пюре Маленькое счастье Груша 90г х 3 шт,https://www.detmir.ru/product/index/id/6003765/
Морс Сады Придонья брусника-малина 0.3л с 3лет,https://www.detmir.ru/product/index/id/1179411/
Каша детская Baby King Organic безмолочная овсяная 175гр с 6 месяцев,https://www.detmir.ru/product/index/id/5141536/
Мюсли Ого! фруктовый микс 400г,https://www.detmir.ru/product/index/id/3604566/
Каша ФрутоНяня молочная пшеничная с яблоком и земляникой 200 г с 6 месяцев,https://www.detmir.ru/product/index/id/511531/
Пюре Heinz хек с картошечкой 120г с 8месяцев,https://www.detmir.ru/product/index/id/454801/
Кашка молочная ФрутоНяня пять злаков с лесными ягодами 0.2л с 6месяцев,https://www.detmir.ru/product/index/id/4018745/
Кашка молочная ФрутоНяня пять злаков с клубникой и бананом 0.2л с 6месяцев,https://www.detmir.ru/product/index/id/4018746/
Пюре Тёма Говядина 100 г,https://www.detmir.ru/product/index/id/506341/
Каша ФрутоНяня молочная овсяная с персиком 200 г с 5 месяцев,https://www.detmir.ru/product/index/id/138412/
Смесь Беллакт Иммунис 1+ 400г с 0месяцев,https://www.detmir.ru/product/index/id/2270641/
Пюре Heinz яблоко-груша-сливки 90г с 6месяцев,https://www.detmir.ru/product/index/id/3228763/
Хлопья многозлаковые Увелка из натуральных ингредиентов 275 г,https://www.detmir.ru/product/index/id/6224351/
Каша молочная Беллакт овсяная с витаминами и минералами 200г с 5месяцев,https://www.detmir.ru/product/index/id/2270701/
Пюре ФрутоНяня из яблок и абрикосов 100 г с 5 месяцев,https://www.detmir.ru/product/index/id/2887301/
Пюре Gerber брокколи 80г,https://www.detmir.ru/product/index/id/500861/
Хлопья FITROO кукурузные медовые без сахара 200г,https://www.detmir.ru/product/index/id/6237793/
Пюре Бибиколь манго-банан-козий творог 80г с 6месяцев,https://www.detmir.ru/product/index/id/2931871/
Пюре Бибиколь груша и козий творожок 80г с 6месяцев,https://www.detmir.ru/product/index/id/3156021/
Вода Святой Источник негазированная 1.5л,https://www.detmir.ru/product/index/id/3176696/
Смесь Friso Gold 2 LockNutri 400г с 6месяцев,https://www.detmir.ru/product/index/id/3188083/
Изделия макаронные Barilla Спагетти без глютена 400г,https://www.detmir.ru/product/index/id/3433293/
Хлопья Агро-Альянс гречневые,https://www.detmir.ru/product/index/id/4758423/
Хлопья ОлЛайт с фруктами яблочные 300г,https://www.detmir.ru/product/index/id/6136413/
Пюре Gerber спелое яблоко 90г,https://www.detmir.ru/product/index/id/2993461/
Каша молочная Nestle мультизлаковая мед-абрикос 220г с 9месяцев,https://www.detmir.ru/product/index/id/3187790/
Каша молочная Nestle овсяная груша-банан 220г с 6месяцев,https://www.detmir.ru/product/index/id/3187796/
Пюре ФрутоKids яблоко-груша- виноград-киви 90г с 9месяцев,https://www.detmir.ru/product/index/id/3496800/
Пюре Gerber яблоко чернослив 130г,https://www.detmir.ru/product/index/id/500971/
Вода пихтовая УралПихтаГиш флорентинная 500 мл,https://www.detmir.ru/product/index/id/6115013/
Сухой завтрак Шарики Тигоро Увелка со вкусом клубники и банана из натуральных ингредиентов 200 г,https://www.detmir.ru/product/index/id/6224293/
Каша ФрутоНяня молочная пшеничная с тыквой 200 г с 5 месяцев,https://www.detmir.ru/product/index/id/138422/
Напиток сокосодержащий ФрутоНяня Иммуно Бэби малина 130мл с 1года,https://www.detmir.ru/product/index/id/3394207/
Хлопья Агро-Альянс из полбы,https://www.detmir.ru/product/index/id/4758422/
Каша молочная Bebi Premium пшеничная печенье-малина-вишня 200г с 6месяцев,https://www.detmir.ru/product/index/id/4778138/
Пюре Маленькое счастье Яблоко 90гр,https://www.detmir.ru/product/index/id/6195009/
Каша безмолочная Gerber Organic гречка-чернослив 180г с 4месяцев,https://www.detmir.ru/product/index/id/3627247/
Пюре Gerber яблоко груша 130г с 5месяцев,https://www.detmir.ru/product/index/id/579871/
Пюре Hipp крем-суп овощи-курица 190г с 6месяцев,https://www.detmir.ru/product/index/id/454041/
Мюсли Bionova Crunchy шоколад-клубника-банан 60г,https://www.detmir.ru/product/index/id/3422211/
Пюре Маленькое счастье Брокколи 80г Х3 шт.,https://www.detmir.ru/product/index/id/5123820/
Сок Fleur Alpine гранат 0.2л с 3лет,https://www.detmir.ru/product/index/id/1819151/
Пюре Gerber груша-яблоко-банан 90г с 6месяцев,https://www.detmir.ru/product/index/id/3177415/
Пюре Gerber фруктово-ягодный микс 90г с 6месяцев,https://www.detmir.ru/product/index/id/3177416/
Хлопья Агро-Альянс пшенно-рисовые 400г,https://www.detmir.ru/product/index/id/4758433/
Хлопья ОлЛайт с фруктами клубничные 300г,https://www.detmir.ru/product/index/id/6136411/
Каша Heinz Я большой овсяная 250г с 12месяцев,https://www.detmir.ru/product/index/id/3004767/
Паштет ФрутоНяня индейка-печень 80г с 18месяцев,https://www.detmir.ru/product/index/id/3170047/
Пюре Gerber яблоко-кабачок 130г,https://www.detmir.ru/product/index/id/500831/
Мюсли ОлЛайт медовые тропические фрукты 60г,https://www.detmir.ru/product/index/id/3422262/
Завтрак Вастэко Полба со стевией 150г,https://www.detmir.ru/product/index/id/3794980/
Пюре Маленькое счастье Яблоко-Груша гуалапак 90г Х3 шт.,https://www.detmir.ru/product/index/id/5124090/
Каша молочная Nestle овсяная с яблоком 220г с 6месяцев,https://www.detmir.ru/product/index/id/3187794/
Пюре Heinz кабачки 2*80г с 4месяцев,https://www.detmir.ru/product/index/id/454291/
Пюре Gerber яблоко абрикос банан 130г,https://www.detmir.ru/product/index/id/501021/
Мюсли Bionova Crunchy ягодные 60г,https://www.detmir.ru/product/index/id/3422208/
Мюсли Bionova Crunchy шоколадные 60г,https://www.detmir.ru/product/index/id/3422213/
Пюре Ложка в ладошке яблоко-банан-печенье 90г с 6месяцев,https://www.detmir.ru/product/index/id/4578775/
Хлопья Агро-Альянс из полбы и геркулеса,https://www.detmir.ru/product/index/id/4758429/
Пюре Heinz рагу-говядина 90г с 8месяцев,https://www.detmir.ru/product/index/id/3368271/
Пюре Бибиколь брокколи и козий творожок 80г с 6месяцев,https://www.detmir.ru/product/index/id/3156043/
Каша молочная Nestle мультизлаковая яблоко-банан 220г с 6месяцев,https://www.detmir.ru/product/index/id/3187788/
Чай детский Heinz ромашка 200г с 4месяцев,https://www.detmir.ru/product/index/id/583081/
Пюре Heinz нежная крольчатинка 80 г с 6 мес+,https://www.detmir.ru/product/index/id/20351/
Мюсли Ого! запеченные с бананом 350г,https://www.detmir.ru/product/index/id/3604569/
Пюре Gerber брокколи 130г,https://www.detmir.ru/product/index/id/527501/
Кисель Когда Я вырасту малиновый с 12 мес 85г,https://www.detmir.ru/product/index/id/6165644/
Пюре Тёма Цыпленок с гречкой 100 г,https://www.detmir.ru/product/index/id/1056471/
Кисель ФрутоНяня овсяный яблоко-манго-персик 130г с 1года,https://www.detmir.ru/product/index/id/3412405/
"Пюре Тёма Цыпленок с кабачками, морковью и рисом 100 г",https://www.detmir.ru/product/index/id/1056491/
Колечки медовые Увелка из натуральных ингредиентов 200 г,https://www.detmir.ru/product/index/id/6224449/
Каша безмолочная Малютка гречневая 200г с 4 месяцев,https://www.detmir.ru/product/index/id/158972/
Компот ФрутоНяня яблоко-изюм-курага 0.5л с 3лет,https://www.detmir.ru/product/index/id/577481/
"Морс ФрутоНяня из клюквы 0,5 л от 3 лет",https://www.detmir.ru/product/index/id/577511/
Хлопья ОлЛайт с фруктами тропические 300г,https://www.detmir.ru/product/index/id/6136412/
Кисель Когда Я вырасту вишневый с 12 мес 85г,https://www.detmir.ru/product/index/id/6165645/
Мюсли Ого! фруктовые 280г,https://www.detmir.ru/product/index/id/3604565/
Сухой завтрак Шарики Тигоро Увелка со вкусом банана и шоколада из натуральных ингредиентов 200 г,https://www.detmir.ru/product/index/id/6224294/
Пюре Bebi Premium груша 90г с 4месяцев,https://www.detmir.ru/product/index/id/6222160/
Пюре Bebi Premium яблоко-банан 90г с 6месяцев,https://www.detmir.ru/product/index/id/6222162/
Кукурузные хлопья Увелка со вкусом меда из натуральных ингредиентов 275 г,https://www.detmir.ru/product/index/id/6224397/
Вода Черноголовка детская негазированная 2.5л с 0месяцев,https://www.detmir.ru/product/index/id/3414697/
Кашка молочная Gerber пшенично-овсяная 200мл с 6месяцев,https://www.detmir.ru/product/index/id/3626988/
Хлопья Агро-Альянс 7 злаков,https://www.detmir.ru/product/index/id/4758425/
Пюре ФрутоНяня Салатик из сладких овощей 80 г с 5 месяцев,https://www.detmir.ru/product/index/id/1000871/
Пюре Nestle чернослив 90г с 4месяцев,https://www.detmir.ru/product/index/id/3202522/
Мюсли Bionova Crunchy тропические 60г,https://www.detmir.ru/product/index/id/3422210/
Кашка молочная ФрутоНяня гречневая 0.5л с 3лет,https://www.detmir.ru/product/index/id/3257151/
Пюре Тёма кролик 100 г с 6 месяцев,https://www.detmir.ru/product/index/id/501731/
Безалкогольный напиток Сладкая сказка Тринкета со вкусом клубника 70г,https://www.detmir.ru/product/index/id/6166697/
Пюре ФрутоНяня Organic из манго натуральное 90г с 6месяцев,https://www.detmir.ru/product/index/id/3030484/
"Кисель ФрутоНяня из вишни 0,2 л с 12 месяцев",https://www.detmir.ru/product/index/id/577621/
Пюре Heinz говядинка 80 г с 6 месяцев,https://www.detmir.ru/product/index/id/695031/
Фиточай Здоровье Укропа плоды,https://www.detmir.ru/product/index/id/5001709/
Пюре Маленькое счастье Яблоко-Банан 90г Х3 шт.,https://www.detmir.ru/product/index/id/5124093/
Компот Агуша яблоко-клубника-рябина черноплодная 0.2л с 6месяцев,https://www.detmir.ru/product/index/id/580631/
Пюре Беллакт груша 100г с 6месяцев,https://www.detmir.ru/product/index/id/3494695/
Хлопья Агро-Альянс Геркулес традиционный,https://www.detmir.ru/product/index/id/4758428/
Пюре Тёма телятина 100г с 6месяцев,https://www.detmir.ru/product/index/id/501851/
Сок Сады Придонья мультиовощной восстановленный с имбирем 0.3л с 3лет,https://www.detmir.ru/product/index/id/3171106/
Пюре ФрутоНяня яблоко-ягоды-овсяные хлопья 90г с 6месяцев,https://www.detmir.ru/product/index/id/3897982/
Шоколад Natures own factory Prebiotic гречишный с арахисом 20г,https://www.detmir.ru/product/index/id/4225706/
Хлопья Агро-Альянс 5 злаков,https://www.detmir.ru/product/index/id/4758424/
Мюсли ОлЛайт медовые с фруктами и орехами 60г,https://www.detmir.ru/product/index/id/3422259/
Хлопья Агро-Альянс овсяные с отрубями,https://www.detmir.ru/product/index/id/4758431/
Пюре Тёма Говядина с печенью 100 г,https://www.detmir.ru/product/index/id/501811/
